tag	Shackled World
description	This world is being systematically contained by an outside power. Some ancient autonomous defense grid, robot law enforcement, alien artifact, or other force is preventing the locals from developing certain technology, or using certain devices, or perhaps from developing interstellar flight. This limit may or may not apply to offworlders; in the former case, the PCs may have to figure out a way to beat the shackles simply to escape the world.
enemies	Passionless jailer-AI, Paranoid military grid AI, Robot overlord, Enigmatic alien master
friends	Struggling local researcher, Offworlder trapped here, Scientist with a plan to break the chains
complications	The shackles come off for certain brief windows of time, The locals think the shackles are imposed by God, An outside power greatly profits from the shackles, The rulers are exempt from the shackles
things	Keycode to bypass the shackle, Tech shielded from the shackle, Exportable version of the shackle that can affect other worlds
places	Grim high-tech control center, Factory full of workaround tech, Temple to the power or entity that imposed the shackle
