tag	Seismic Instability
description	The local land masses are remarkably unstable, and regular earthquakes rack the surface. Local construction is either advanced enough to sway and move with the vibrations or primitive enough that it is easily rebuilt. Severe volcanic activity may be part of the instability.
enemies	Earthquake cultist, Hermit seismologist, Burrowing native life form, Earthquake-inducing saboteur
friends	Experimental construction firm owner, Adventurous volcanologist, Geothermal prospector
complications	The earthquakes are caused by malfunctioning pretech terraformers, They’re caused by alien technology, They’re restrained by alien technology that is being plundered by offworlders, The earthquakes are used to generate enormous amounts of energy.
things	Earthquake generator, Earthquake suppressor, Mineral formed at the core of the world, Earthquake-proof building schematics
places	Volcanic caldera, Village during an earthquake, Mud slide, Earthquake opening superheated steam fissures
