tag	Secret Masters
description	The world is actually run by a hidden cabal, acting through their catspaws in the visible government. For one reason or another, this group finds it imperative that they not be identified by outsiders, and in some cases even the planet’s own government may not realize that they’re actually being manipulated by hidden masters.
enemies	An agent of the cabal, Government official who wants no questions asked, Willfully blinded local
friends	Paranoid conspiracy theorist, Machiavellian gamesman within the cabal, Interstellar investigator
complications	The secret masters have a benign reason for wanting secrecy, The cabal fights openly amongst itself, The cabal is recruiting new members
things	A dossier of secrets on a government official, A briefcase of unmarked credit notes, The identity of a cabal member
places	Smoke-filled room, Shadowy alleyway, Secret underground bunker
