tag	Local Specialty
description	The world may be sophisticated or barely capable of steam engines, but either way it produces something rare and precious to the wider galaxy. It might be some pharmaceutical extract produced by a secret recipe, a remarkably popular cultural product, or even gengineered humans uniquely suited for certain work.
enemies	Monopolist, Offworlder seeking prohibition of the specialty, Native who views the specialty as sacred
friends	Spy searching for the source, Artisan seeking protection, Exporter with problems
complications	The specialty is repugnant in nature, The crafters refuse to sell to offworlders, The specialty is made in a remote, dangerous place, The crafters don’t want to make the specialty any more
things	The specialty itself, The secret recipe, Sample of a new improved variety
places	Secret manufactory, Hidden cache, Artistic competition for best artisan
