tag	Rigid Culture
description	The local culture is extremely rigid. Certain forms of behavior and belief are absolutely mandated, and any deviation from these principles is punished, or else society may be strongly stratified by birth with limited prospects for change. Anything which threatens the existing social order is feared and shunned.
enemies	Rigid reactionary, Wary ruler, Regime ideologue, Offended potentate
friends	Revolutionary agitator, Ambitious peasant, Frustrated merchant
complications	The cultural patterns are enforced by technological aids, The culture is run by a secret cabal of manipulators, The culture has explicit religious sanction, The culture evolved due to important necessities that have since been forgotten
things	Precious traditional regalia, Peasant tribute, Opulent treasures of the ruling class
places	Time-worn palace, Low-caste slums, Bandit den, Reformist temple
